{"schema":"chancadem.hp500.backbone/v1","source":{"paper":"Rocha, Campos, Silva & Tavares 2024","doi":"10.3390/min14090919","license":"CC BY 4.0","table":"A1 (measured) + 5 (fit)"},"engine_version":"0.09.003","note":"Backbone = the live calibrated TypeScript Whiten/Evertsson/Bond engine on each real survey. Measured t/h and kW are ground truth; P80 is a model output (paper PSD curves are figure-only), graded as self-consistency. The paper power constants zeta=1.30, Pn=110 apply to the paper size-specific Pd, NOT the classical Bond draw here.","n":10,"surveys":[{"id":"HP500-01","n":1,"measured":{"css_mm":54,"f80_mm":88,"feed_tph":1639,"power_kw":209},"backbone":{"p80_mm":32.56,"throughput_tph":1208.87,"bond_power_kw":229.5,"calibrated_power_kw":408.34,"f80_model_mm":84.86}},{"id":"HP500-02","n":2,"measured":{"css_mm":54,"f80_mm":84,"feed_tph":1267,"power_kw":212},"backbone":{"p80_mm":31.36,"throughput_tph":1208.87,"bond_power_kw":233.73,"calibrated_power_kw":413.85,"f80_model_mm":81.7}},{"id":"HP500-03","n":3,"measured":{"css_mm":48,"f80_mm":47,"feed_tph":1240,"power_kw":262},"backbone":{"p80_mm":21.23,"throughput_tph":1106.71,"bond_power_kw":224.86,"calibrated_power_kw":402.31,"f80_model_mm":47.15}},{"id":"HP500-04","n":4,"measured":{"css_mm":48,"f80_mm":88,"feed_tph":1034,"power_kw":349},"backbone":{"p80_mm":30.8,"throughput_tph":1106.71,"bond_power_kw":225.66,"calibrated_power_kw":403.36,"f80_model_mm":84.86}},{"id":"HP500-05","n":5,"measured":{"css_mm":48,"f80_mm":62,"feed_tph":1124,"power_kw":325},"backbone":{"p80_mm":24.54,"throughput_tph":1106.71,"bond_power_kw":234.76,"calibrated_power_kw":415.19,"f80_model_mm":61.66}},{"id":"HP500-06","n":6,"measured":{"css_mm":40,"f80_mm":79,"feed_tph":813,"power_kw":355},"backbone":{"p80_mm":26.54,"throughput_tph":970.5,"bond_power_kw":222.5,"calibrated_power_kw":399.26,"f80_model_mm":77.55}},{"id":"HP500-07","n":7,"measured":{"css_mm":38,"f80_mm":140,"feed_tph":1050,"power_kw":306},"backbone":{"p80_mm":36.6,"throughput_tph":936.45,"bond_power_kw":196.14,"calibrated_power_kw":364.98,"f80_model_mm":118.94}},{"id":"HP500-08","n":8,"measured":{"css_mm":44,"f80_mm":123,"feed_tph":1138,"power_kw":325},"backbone":{"p80_mm":35.69,"throughput_tph":1038.61,"bond_power_kw":212.74,"calibrated_power_kw":386.56,"f80_model_mm":109.85}},{"id":"HP500-09","n":9,"measured":{"css_mm":40,"f80_mm":81,"feed_tph":820,"power_kw":350},"backbone":{"p80_mm":26.97,"throughput_tph":970.5,"bond_power_kw":221.57,"calibrated_power_kw":398.04,"f80_model_mm":79.24}},{"id":"HP500-10","n":10,"measured":{"css_mm":55,"f80_mm":81,"feed_tph":1334,"power_kw":187},"backbone":{"p80_mm":30.72,"throughput_tph":1225.89,"bond_power_kw":237.49,"calibrated_power_kw":418.74,"f80_model_mm":79.24}}]}
